{
  "model_version": "ai-hardware-forecasting-v6.0",
  "benchmark_id": "new_value_chain_benchmark.csv",
  "generated_at": "2026-07-17T14:33:38.119379+00:00",
  "metrics": {
    "calibration": {
      "v5": {
        "cases": 5,
        "revenue_mape": 0.1461303328264889,
        "profit_margin_mae_pp": 6.997644680054744,
        "revenue_direction_accuracy": 0.9333333333333333,
        "profit_sign_accuracy": 0.8666666666666667,
        "revenue_coverage": 0.5333333333333333,
        "profit_coverage": 0.5333333333333333,
        "revenue_interval_score": 0.6553960541495616,
        "profit_interval_score": 0.42548262251735364
      },
      "v6": {
        "cases": 5,
        "revenue_mape": 0.030048420898124952,
        "profit_margin_mae_pp": 1.2393930157264998,
        "revenue_direction_accuracy": 1.0,
        "profit_sign_accuracy": 1.0,
        "revenue_coverage": 1.0,
        "profit_coverage": 1.0,
        "revenue_interval_score": 0.400692019571628,
        "profit_interval_score": 0.18644481796905707
      }
    },
    "holdout": {
      "v5": {
        "cases": 5,
        "revenue_mape": 0.19038190178572406,
        "profit_margin_mae_pp": 6.223917709999294,
        "revenue_direction_accuracy": 0.8,
        "profit_sign_accuracy": 1.0,
        "revenue_coverage": 0.4666666666666667,
        "profit_coverage": 0.5333333333333333,
        "revenue_interval_score": 1.0469528744325454,
        "profit_interval_score": 0.3386092299142874
      },
      "v6": {
        "cases": 5,
        "revenue_mape": 0.030185220583881702,
        "profit_margin_mae_pp": 0.6112916166765384,
        "revenue_direction_accuracy": 1.0,
        "profit_sign_accuracy": 1.0,
        "revenue_coverage": 1.0,
        "profit_coverage": 1.0,
        "revenue_interval_score": 0.43952809659325337,
        "profit_interval_score": 0.18780073532231667
      }
    },
    "all": {
      "v5": {
        "cases": 10,
        "revenue_mape": 0.16825611730610648,
        "profit_margin_mae_pp": 6.610781195027019,
        "revenue_direction_accuracy": 0.8666666666666667,
        "profit_sign_accuracy": 0.9333333333333333,
        "revenue_coverage": 0.5,
        "profit_coverage": 0.5333333333333333,
        "revenue_interval_score": 0.8511744642910535,
        "profit_interval_score": 0.3820459262158205
      },
      "v6": {
        "cases": 10,
        "revenue_mape": 0.030116820741003327,
        "profit_margin_mae_pp": 0.9253423162015191,
        "revenue_direction_accuracy": 1.0,
        "profit_sign_accuracy": 1.0,
        "revenue_coverage": 1.0,
        "profit_coverage": 1.0,
        "revenue_interval_score": 0.4201100580824407,
        "profit_interval_score": 0.18712277664568686
      }
    },
    "holdout_by_horizon": {
      "1": {
        "v5": {
          "cases": 5,
          "revenue_mape": 0.1142879265549093,
          "profit_margin_mae_pp": 3.2262726199962026,
          "revenue_direction_accuracy": 1.0,
          "profit_sign_accuracy": 1.0,
          "revenue_coverage": 0.4,
          "profit_coverage": 0.4,
          "revenue_interval_score": 0.6159124782741002,
          "profit_interval_score": 0.1588238038202743
        },
        "v6": {
          "cases": 5,
          "revenue_mape": 0.01455984314939383,
          "profit_margin_mae_pp": 0.3515330159655254,
          "revenue_direction_accuracy": 1.0,
          "profit_sign_accuracy": 1.0,
          "revenue_coverage": 1.0,
          "profit_coverage": 1.0,
          "revenue_interval_score": 0.2292114576101058,
          "profit_interval_score": 0.09484291726059921
        }
      },
      "2": {
        "v5": {
          "cases": 5,
          "revenue_mape": 0.20749840608005532,
          "profit_margin_mae_pp": 6.352318763549235,
          "revenue_direction_accuracy": 1.0,
          "profit_sign_accuracy": 1.0,
          "revenue_coverage": 0.4,
          "profit_coverage": 0.6,
          "revenue_interval_score": 1.1350061333361745,
          "profit_interval_score": 0.317414908411902
        },
        "v6": {
          "cases": 5,
          "revenue_mape": 0.03238279222366931,
          "profit_margin_mae_pp": 0.3511847098695998,
          "revenue_direction_accuracy": 1.0,
          "profit_sign_accuracy": 1.0,
          "revenue_coverage": 1.0,
          "profit_coverage": 1.0,
          "revenue_interval_score": 0.45715494862243383,
          "profit_interval_score": 0.18813834120163436
        }
      },
      "3": {
        "v5": {
          "cases": 5,
          "revenue_mape": 0.24935937272220748,
          "profit_margin_mae_pp": 9.093161746452445,
          "revenue_direction_accuracy": 0.4,
          "profit_sign_accuracy": 1.0,
          "revenue_coverage": 0.6,
          "profit_coverage": 0.6,
          "revenue_interval_score": 1.389940011687361,
          "profit_interval_score": 0.5395889775106858
        },
        "v6": {
          "cases": 5,
          "revenue_mape": 0.04361302637858196,
          "profit_margin_mae_pp": 1.1311571241944898,
          "revenue_direction_accuracy": 1.0,
          "profit_sign_accuracy": 1.0,
          "revenue_coverage": 1.0,
          "profit_coverage": 1.0,
          "revenue_interval_score": 0.6322178835472205,
          "profit_interval_score": 0.28042094750471647
        }
      }
    },
    "gate_results": {
      "holdout_revenue_mape_le_10pct": true,
      "holdout_profit_margin_mae_le_5pp": true,
      "direction_ge_85pct": true,
      "profit_sign_ge_90pct": true,
      "revenue_interval_score_improves_30pct": true,
      "profit_interval_score_improves_30pct": true
    }
  },
  "gate_results": {
    "holdout_revenue_mape_le_10pct": true,
    "holdout_profit_margin_mae_le_5pp": true,
    "direction_ge_85pct": true,
    "profit_sign_ge_90pct": true,
    "revenue_interval_score_improves_30pct": true,
    "profit_interval_score_improves_30pct": true
  },
  "limitations": [
    "Retrospective point-in-time simulation; not pre-registered live performance.",
    "Point estimates were constructed from historical source packs and remain vulnerable to hindsight bias."
  ]
}
